{
  "schemaVersion": 1,
  "gameBuild": {
    "replayVersion": 2119,
    "gameVersion": "1.11.0.2a",
    "gameAssemblySha256": null
  },
  "source": {
    "type": "replay",
    "uri": "replay:///example.grbr",
    "capturedAtUtc": null
  },
  "match": {
    "battleId": "example-battle",
    "mapId": 1001,
    "gameMode": "Normal",
    "matchMode": "VS_1_1",
    "round": 3,
    "phase": "battle_start"
  },
  "players": [
    {
      "playerId": "1001",
      "name": "Player A",
      "team": 0,
      "state": "BattleStart",
      "supply": 100,
      "reactorCore": 3200,
      "previousFightResult": "Win",
      "units": [
        {
          "unitId": 3,
          "unitName": "Vulcan / 火神",
          "formationIndex": 0,
          "rawLevel": 1,
          "displayLevel": 2,
          "experience": 120,
          "x": -40,
          "y": -150,
          "isRotated": false,
          "equipmentId": 0,
          "sellSupply": 400,
          "roundCount": 2,
          "durability": 0
        }
      ],
      "activeTechnologies": [
        {
          "unitId": 3,
          "unitName": "Vulcan / 火神",
          "technologyIds": [30101]
        }
      ]
    },
    {
      "playerId": "1002",
      "name": "Player B",
      "team": 1,
      "state": "BattleStart",
      "supply": 50,
      "reactorCore": 2800,
      "previousFightResult": "Lose",
      "units": [],
      "activeTechnologies": []
    }
  ],
  "outcome": {
    "winnerIndex": 0,
    "winnerPlayerId": "1001",
    "winnerName": "Player A"
  }
}
